{
  "task_id": "T0035",
  "status": "DONE",
  "claimed_at": "2026-05-20T09:36:00Z",
  "finished_at": "2026-05-20T09:39:42Z",
  "duration_sec": 222,
  "machine": "YIZHIDIANLU",
  "worker_version": "claude-code-interactive-v1",
  "result": {
    "csim_pass": true,
    "csim_exact_mismatches": 0,
    "csim_total_bytes": 1048576,
    "csynth_pass": true,
    "loop_constraints_satisfied": true,
    "fmax_estimated_mhz": 342.47,
    "clock_target_ns": 4.0,
    "target_part_used": "xcvc1902-vsva2197-2MP-e-S",
    "module_name": "hbm_weight_tiler",
    "latency_cycles": 1048813,
    "latency_ms_at_250mhz": 4.195,
    "lut_used": 6242,
    "ff_used": 5325,
    "dsp_used": 0,
    "bram_used": 7,
    "uram_used": 0,
    "tile_elems": 65536,
    "n_tiles": 16,
    "working_set_bytes": 1048576,
    "m_axi_ports": 1,
    "architecture": "m_axi HBM burst read + DATAFLOW ping-pong (hls::stream double-buffer) read/feed overlap. 1 byte/cycle byte-wide port.",
    "iterations_to_pass": 1
  },
  "acceptance_criteria_passed": true,
  "human_ack_needed": true,
  "human_ack_reasons": [
    "latency_above_200000 triggered: 1,048,813 cycles (4.195 ms) to move the full 1 MB language-step weight working set over a byte-wide HBM port. BENIGN — the language path runs at 1 Hz (1000 ms budget); 4.195 ms is 0.42% of budget, exactly the intended bursty-HBM behaviour. A v1 512-bit m_axi widening would cut this ~64x if ever needed. Flagged for honesty; within architectural budget."
  ],
  "artefacts": [
    "coord/reports/T0035/stdout.log",
    "coord/reports/T0035/result.json",
    "coord/reports/T0035/hbm_weight_tiler.cpp",
    "coord/reports/T0035/hbm_weight_tiler.hpp",
    "coord/reports/T0035/hbm_weight_tiler_tb.cpp",
    "coord/reports/T0035/run_hls.tcl",
    "coord/reports/T0035/hls.log",
    "coord/reports/T0035/hbm_weight_tiler_csynth.rpt"
  ],
  "next_task_suggestion": "T0034 vivado_ipi_integrate_impl (P1, last remaining task)",
  "error": null
}
