{
  "task_id": "T0025",
  "status": "DONE",
  "claimed_at": "2026-05-19T03:00:00Z",
  "finished_at": "2026-05-19T03:02:38Z",
  "duration_sec": 158,
  "machine": "YIZHIDIANLU",
  "worker_version": "claude-code-interactive-v1",
  "result": {
    "csim_pass": true,
    "csim_cases_total": 1,
    "csim_cases_failed": 0,
    "csim_exact_mismatches": 0,
    "csim_total_elements_compared": 1048576,
    "csynth_pass": true,
    "loop_constraints_satisfied": true,
    "fmax_estimated_mhz": 367.71,
    "clock_target_ns": 4.0,
    "clock_estimated_ns": 2.720,
    "target_part_used": "xcvc1902-vsva2197-2MP-e-S",
    "module_name": "gvsa_matmul",
    "shape": "P[1024x1024] = Q[1024x64] · Kmat[64x1024], all INT8",
    "algorithm": "ijk matmul, k-unroll=64 (fully) + j-loop PIPELINE II=1",
    "latency_cycles": 1048583,
    "latency_ms_at_250mhz": 4.194,
    "interval_cycles": 1048576,
    "ii": 1,
    "lut_used": 3657,
    "ff_used": 732,
    "dsp_used": 32,
    "bram_used": 0,
    "uram_used": 0,
    "lut_pct": 0.41,
    "ff_pct": 0.04,
    "dsp_pct": 1.63,
    "bram_pct": 0.00,
    "dsp58_int8_packing_observed": true,
    "dsp58_packing_note": "k-unroll=64 specified, expected ~64 DSPs. HLS used 32 DSP58 — confirms automatic INT8x2 packing (DSP58 dotp pattern). Some smaller mults moved to LUT-based 'mul_8s_8s_16_1_1_UX' instances (~85 LUT each, 5 instances visible).",
    "iterations_tried": 1,
    "iteration_note": "v0 one-shot pass — no iterations needed. All hard acceptance criteria met first try.",
    "v1_candidate_design": "j-unroll=16 + k-unroll=32 → 256 DSPs packed, ~131k cycles. To hit <70k soft cap would need >1024 MACs/cycle = 512 DSPs (exactly at cap, strict acceptance fails)."
  },
  "acceptance_criteria_passed": true,
  "human_ack_needed": true,
  "human_ack_reasons": [
    "latency_above_70000 triggered (soft warning): 1,048,583 >> 70,000. Hitting <70k requires >1024 MACs/cycle = 512+ DSPs which conflicts with strict <512 DSP acceptance cap. Either scope_change dsp_max → 600, or ACK proceed on this v0 baseline."
  ],
  "artefacts": [
    "coord/reports/T0025/stdout.log",
    "coord/reports/T0025/result.json",
    "coord/reports/T0025/gvsa_matmul.hpp",
    "coord/reports/T0025/gvsa_matmul.cpp",
    "coord/reports/T0025/gvsa_matmul_tb.cpp",
    "coord/reports/T0025/run_hls.tcl",
    "coord/reports/T0025/hls.log",
    "coord/reports/T0025/gvsa_matmul_csynth.rpt",
    "coord/reports/T0025/csynth.rpt"
  ],
  "next_task_suggestion": "T0026 (action_diff_head) still pending. Has formal deps [T0014] met but notes ask for reuse of xmod_attn engine — depends on T0024 ACK outcome.",
  "error": null
}
