{
  "task_id": "T0029",
  "status": "DONE",
  "claimed_at": "2026-05-20T02:20:00Z",
  "finished_at": "2026-05-20T02:27:31Z",
  "duration_sec": 451,
  "machine": "YIZHIDIANLU",
  "worker_version": "claude-code-interactive-v1",
  "result": {
    "csim_pass": true,
    "csim_exact_mismatches": 0,
    "csim_total_elements": 98304,
    "csim_max_abs_diff": 0,
    "csynth_pass": true,
    "loop_constraints_satisfied": true,
    "physically_implementable": true,
    "fmax_estimated_mhz": 344.59,
    "clock_target_ns": 4.0,
    "target_part_used": "xcvc1902-vsva2197-2MP-e-S",
    "module_name": "vit_encoder_12layer",
    "architecture": "12 transformer layers time-multiplexed onto ONE physical vit_transformer_layer instance (#pragma HLS INLINE off)",
    "n_layers": 12,
    "latency_cycles": 862636461,
    "latency_sec_at_250mhz": 3.451,
    "per_layer_latency_cycles": 71771676,
    "lut_used": 9398,
    "ff_used": 4255,
    "dsp_used": 36,
    "bram_used": 1,
    "uram_used": 79,
    "uram_available": 463,
    "lut_pct": 1.04,
    "dsp_pct": 1.83,
    "bram_pct": 0.05,
    "uram_pct": 17.06,
    "time_multiplex_confirmed": true,
    "time_multiplex_note": "DSP=36 is IDENTICAL to one standalone vit_transformer_layer (T0028 v4). 12 layers share one physical instance. Inlining 12 copies would have been ~432 DSP / ~864 URAM (URAM over 463 limit).",
    "all_loops_ii_1": true,
    "iterations_to_pass": 1
  },
  "acceptance_criteria_passed": true,
  "human_ack_needed": true,
  "human_ack_reasons": [
    "latency_above_900000 triggered: 862,636,461 cycles (3.45 s) >> 900,000. This is the PL-only ViT ablation path — orch's T0028 ACK already established that slow PL-only latency is expected/acceptable ablation evidence. Flagging for honesty; recommend orch ACK-proceed or scope_change the trigger threshold."
  ],
  "artefacts": [
    "coord/reports/T0029/stdout.log",
    "coord/reports/T0029/result.json",
    "coord/reports/T0029/vit_encoder_12layer.cpp",
    "coord/reports/T0029/vit_encoder_12layer.hpp",
    "coord/reports/T0029/vit_transformer_layer.cpp",
    "coord/reports/T0029/vit_transformer_layer.hpp",
    "coord/reports/T0029/vit_encoder_12layer_tb.cpp",
    "coord/reports/T0029/run_hls.tcl",
    "coord/reports/T0029/hls.log",
    "coord/reports/T0029/vit_encoder_12layer_csynth.rpt",
    "coord/reports/T0029/csynth.rpt"
  ],
  "next_task_suggestion": "T0031 mr_vla_full_top — ALL 6 dependencies (T0024/25/26/27/29/30) now satisfied. Headline integration task is unblocked.",
  "error": null
}
