{
  "task_id": "T0020",
  "status": "DONE",
  "claimed_at": "2026-05-18T16:51:30Z",
  "finished_at": "2026-05-18T16:58:49Z",
  "duration_sec": 439,
  "machine": "YIZHIDIANLU",
  "worker_version": "claude-code-interactive-v1",
  "result": {
    "csim_pass": true,
    "csim_cases_total": 5,
    "csim_errors": 0,
    "csynth_pass": true,
    "loop_constraints_satisfied": true,
    "fmax_estimated_mhz": 384.02,
    "clock_target_ns": 4.0,
    "clock_estimated_ns": 2.604,
    "clock_uncertainty_ns": 1.08,
    "target_part_used": "xcvc1902-vsva2197-2MP-e-S",
    "algorithm_chosen": "systolic-insertion-sort",
    "algorithm_note": "Each of K=64 cells holds (value, index). Per cycle, all cells in parallel: (1) compare own value with the new input scalar, (2) consult right-neighbor's compare result, (3) 3-way mux to either keep self, shift right-neighbor in, or accept new input as insertion point. Strictly local per-cell logic = 1 compare + 1 mux, fits well under 4 ns.",
    "latency_cycles": 327,
    "latency_us_at_250mhz": 1.308,
    "interval_cycles": 328,
    "main_loop_ii": 1,
    "main_loop_depth": 2,
    "main_loop_latency_cycles": 258,
    "write_loop_ii": 1,
    "write_loop_depth": 1,
    "write_loop_latency_cycles": 66,
    "ii": 1,
    "lut_used": 7418,
    "ff_used": 2083,
    "dsp_used": 0,
    "bram_used": 0,
    "uram_used": 0,
    "lut_pct": 0.82,
    "ff_pct": 0.12,
    "dsp_pct": 0.00,
    "bram_pct": 0.00,
    "breakdown": {
      "main_loop":  {"lut": 6687, "ff": 2068, "dsp": 0, "bram": 0},
      "write_loop": {"lut":  707, "ff":    9, "dsp": 0, "bram": 0}
    },
    "interface": "ap_ctrl_hs only on return; arrays default to ap_memory (BRAM port). No m_axi — this IP is designed to be inlined into T0022's parent HLS, which carries its own m_axi.",
    "interface_design_decision": "v2 with m_axi gmem_in+gmem_out used 12409 LUT (over the 8000 cap). v3 dropped m_axi → 7418 LUT (under cap). Both versions have identical algorithm and identical correctness.",
    "iterations_to_pass": 3,
    "iterations": [
      {"v": 1, "algo": "argmin-replace", "result": "FAIL — Fmax 15.67 MHz, LUT 9297, II=257 (pipeline collapsed)"},
      {"v": 2, "algo": "systolic insertion sort + m_axi", "result": "FAIL on LUT — Fmax 342 MHz OK but LUT 12409 > 8000 cap"},
      {"v": 3, "algo": "systolic insertion sort + ap_memory only", "result": "PASS — Fmax 384 MHz, LUT 7418, all II=1"}
    ]
  },
  "acceptance_criteria_passed": true,
  "human_ack_needed": false,
  "human_ack_reasons": [],
  "artefacts": [
    "coord/reports/T0020/stdout.log",
    "coord/reports/T0020/result.json",
    "coord/reports/T0020/topk_engine.hpp",
    "coord/reports/T0020/topk_engine.cpp",
    "coord/reports/T0020/topk_engine_tb.cpp",
    "coord/reports/T0020/run_hls.tcl",
    "coord/reports/T0020/hls.log",
    "coord/reports/T0020/topk_engine_csynth.rpt",
    "coord/reports/T0020/csynth.rpt",
    "coord/reports/T0020/hls_v1_argmin_replace.log",
    "coord/reports/T0020/hls_v2_with_axi.log"
  ],
  "next_task_suggestion": "T0022 (xmod_attn_v0) — unblocked now; will reuse topk_engine.cpp/.hpp as a submodule.",
  "error": null
}
