{
  "task_id": "T0010",
  "status": "DONE",
  "claimed_at": "2026-05-18T16:33:50Z",
  "finished_at": "2026-05-18T16:40:06Z",
  "duration_sec": 376,
  "machine": "YIZHIDIANLU",
  "worker_version": "claude-code-interactive-v1",
  "result": {
    "hostname": "YIZHIDIANLU",
    "os": "Microsoft Windows 11 家庭中文版 build 26200",
    "platform": "windows",
    "gpu_name": "NVIDIA GeForce RTX 3060 Laptop GPU",
    "gpu_mem_mib": 6144,
    "driver_version": "546.30",
    "compute_cap": "8.6",
    "cpu_logical_cores": 16,
    "ram_gb": 15.9,
    "disk_free_C_gb": 100.7,
    "disk_total_C_gb": 200.0,
    "disk_free_E_gb": 274.9,
    "python_version": "3.13.13",
    "python_path": "E:\\Applaction\\Miniconda3\\python.exe",
    "vitis_hls_path": "E:\\Applaction\\Xilinx\\Vitis_HLS\\2024.1\\bin\\vitis_hls.bat",
    "vivado_path": "E:\\Applaction\\Xilinx\\Vivado\\2024.1\\bin\\vivado.bat",
    "vpp_path": "E:\\Applaction\\Xilinx\\Vitis\\2024.1\\bin\\v++.bat",
    "aiecompiler_path": "",
    "vitis_hls_version": "",
    "vivado_version": "",
    "vitis_hls_version_note": "deferred to T0011 (vitis_install_check) — tool launch is the install-check job, not env_probe",
    "vivado_version_note": "deferred to T0011",
    "claude_cli_path": "C:\\Users\\jielu\\.local\\bin\\claude.exe",
    "git_version": "2.54.0.windows.1",
    "git_head": "cda435f61985bfe6affbf715b0905b11f330fd01",
    "vitis_settings_bat": "E:\\Applaction\\Xilinx\\Vitis\\2024.1\\settings64.bat",
    "vitis_hls_settings_bat": "E:\\Applaction\\Xilinx\\Vitis_HLS\\2024.1\\settings64.bat",
    "vivado_settings_bat": "E:\\Applaction\\Xilinx\\Vivado\\2024.1\\settings64.bat"
  },
  "acceptance_criteria_passed": true,
  "human_ack_needed": false,
  "human_ack_reasons": [],
  "artefacts": [
    "coord/reports/T0010/stdout.log",
    "coord/reports/T0010/result.json"
  ],
  "next_task_suggestion": "T0011",
  "error": null
}
